Sheet: Tanks
J1: Drag | N1: Break
B2: PartName | C2: dia | D2: Len | E2: Mass | F2: WetMass | I2: tech | J2: max | K2: min | L2: ang | M2: crash | N2: force | O2: torque | P2: thrust | Q2: heat | R2: max temp | T2: Vol | U2: RF Vol | W2: T/m^3 | Z2: fuel/T | AD2: break/mass
A3: Mixed fuel tanks | G3: Liq | H3: Ox | X3: Lq/m^3 | Y3: Ox/m^2 | AA3: Liq/T | AB3: Ox/T
A4: Oscar-B | B4: miniFuelTank | C4: 0.625 | D4: 0.3485474 | E4: 0.025 | G4: 18 | H4: 22 | I4: precisionEngineering | J4: 0.2 | K4: 0.15 | L4: 2 | M4: 6 | N4: 50 | O4: 50 | R4: 2000 | T4: of:=[.D4]*PI()*[.C4]^2*0.25 -> 0.106933003053498 | U4: 62.5 | V4: of:=[.U4]/1000/[.T4] -> 0.584478114476327 | W4: of:=[.E4]/[.$T4] -> 0.233791245790531 | X4: of:=[.G4]/[.$T4] -> 168.329696969182 | Y4: of:=[.H4]/[.$T4] -> 205.736296295667 | Z4: of:=SUM([.G4:.H4])/[.E4] -> 1600 | AA4: of:=[.G4]/[.E4] -> 720 | AB4: of:=[.H4]/[.E4] -> 880 | AD4: of:=[.N4]/[.E4] -> 2000
A5: Toroidal ROUND-8 | B5: toroidalFuelTank | E5: 0.0375 | G5: 27 | H5: 33 | I5: precisionEngineering | J5: 0.2 | K5: 0.15 | L5: 2 | M5: 6 | N5: 50 | O5: 50 | R5: 2000 | Z5: of:=SUM([.G5:.H5])/[.E5] -> 1600 | AA5: of:=[.G5]/[.E5] -> 720 | AB5: of:=[.H5]/[.E5] -> 880 | AD5: of:=[.N5]/[.E5] -> 1333.33333333333
A6: FL-T100 | B6: fuelTankSmallFlat | C6: 1.25 | D6: 0.78125 | E6: 0.0625 | G6: 45 | H6: 55 | I6: basicRocketry | J6: 0.2 | K6: 0.2 | L6: 2 | M6: 6 | N6: 50 | O6: 50 | R6: 2000 | T6: of:=[.D6]*PI()*[.C6]^2*0.25 -> 0.958737992428526 | U6: 500 | V6: of:=[.U6]/1000/[.T6] -> 0.521518917523523 | W6: of:=[.E6]/[.$T6] -> 0.0651898646904403 | X6: of:=[.G6]/[.$T6] -> 46.936702577117 | Y6: of:=[.H6]/[.$T6] -> 57.3670809275875 | Z6: of:=SUM([.G6:.H6])/[.E6] -> 1600 | AA6: of:=[.G6]/[.E6] -> 720 | AB6: of:=[.H6]/[.E6] -> 880 | AD6: of:=[.N6]/[.E6] -> 800
A7: FL-T200 | B7: fuelTankSmall | C7: 1.25 | D7: 1.1105 | E7: 0.125 | G7: 90 | H7: 110 | I7: start | J7: 0.2 | K7: 0.2 | L7: 2 | M7: 6 | N7: 50 | O7: 50 | R7: 2000 | T7: of:=[.D7]*PI()*[.C7]^2*0.25 -> 1.3627885319576 | U7: 1000 | V7: of:=[.U7]/1000/[.T7] -> 0.733789562026568 | W7: of:=[.E7]/[.$T7] -> 0.091723695253321 | X7: of:=[.G7]/[.$T7] -> 66.0410605823912 | Y7: of:=[.H7]/[.$T7] -> 80.7168518229225 | Z7: of:=SUM([.G7:.H7])/[.E7] -> 1600 | AA7: of:=[.G7]/[.E7] -> 720 | AB7: of:=[.H7]/[.E7] -> 880 | AD7: of:=[.N7]/[.E7] -> 400
A8: FL-T400 | B8: fuelTank | C8: 1.25 | D8: 1.87819 | E8: 0.25 | G8: 180 | H8: 220 | I8: basicRocketry | J8: 0.2 | K8: 0.2 | L8: 2 | M8: 6 | N8: 50 | O8: 50 | R8: 2000 | T8: of:=[.D8]*PI()*[.C8]^2*0.25 -> 2.30488590079915 | U8: 2000 | V8: of:=[.U8]/1000/[.T8] -> 0.867721911660166 | W8: of:=[.E8]/[.$T8] -> 0.108465238957521 | X8: of:=[.G8]/[.$T8] -> 78.094972049415 | Y8: of:=[.H8]/[.$T8] -> 95.4494102826183 | Z8: of:=SUM([.G8:.H8])/[.E8] -> 1600 | AA8: of:=[.G8]/[.E8] -> 720 | AB8: of:=[.H8]/[.E8] -> 880 | AD8: of:=[.N8]/[.E8] -> 200
A9: FL-T800 | B9: fuelTank_long | C9: 1.25 | D9: 3.75 | E9: 0.5 | G9: 360 | H9: 440 | I9: advRocketry | J9: 0.2 | K9: 0.2 | L9: 2 | M9: 6 | N9: 50 | O9: 50 | R9: 2000 | T9: of:=[.D9]*PI()*[.C9]^2*0.25 -> 4.60194236365692 | U9: 4000 | V9: of:=[.U9]/1000/[.T9] -> 0.869198195872538 | W9: of:=[.E9]/[.$T9] -> 0.108649774484067 | X9: of:=[.G9]/[.$T9] -> 78.2278376285284 | Y9: of:=[.H9]/[.$T9] -> 95.6118015459792 | Z9: of:=SUM([.G9:.H9])/[.E9] -> 1600 | AA9: of:=[.G9]/[.E9] -> 720 | AB9: of:=[.H9]/[.E9] -> 880 | AD9: of:=[.N9]/[.E9] -> 100
A10: X200-8 | B10: fuelTank4-2 | C10: 2.5 | D10: 0.9375 | E10: 0.5 | G10: 360 | H10: 440 | I10: advConstruction | J10: 0.2 | K10: 0.2 | L10: 2 | M10: 6 | N10: 200 | O10: 200 | R10: 2000 | T10: of:=[.D10]*PI()*[.C10]^2*0.25 -> 4.60194236365692 | U10: 4000 | V10: of:=[.U10]/1000/[.T10] -> 0.869198195872538 | W10: of:=[.E10]/[.$T10] -> 0.108649774484067 | X10: of:=[.G10]/[.$T10] -> 78.2278376285284 | Y10: of:=[.H10]/[.$T10] -> 95.6118015459792 | Z10: of:=SUM([.G10:.H10])/[.E10] -> 1600 | AA10: of:=[.G10]/[.E10] -> 720 | AB10: of:=[.H10]/[.E10] -> 880 | AD10: of:=[.N10]/[.E10] -> 400
A11: X200-16 | B11: fuelTank2-2 | C11: 2.5 | D11: 1.875 | E11: 1 | G11: 720 | H11: 880 | I11: heavyRocketry | J11: 0.2 | K11: 0.2 | L11: 2 | M11: 6 | N11: 200 | O11: 200 | R11: 2000 | T11: of:=[.D11]*PI()*[.C11]^2*0.25 -> 9.20388472731385 | U11: 8000 | V11: of:=[.U11]/1000/[.T11] -> 0.869198195872538 | W11: of:=[.E11]/[.$T11] -> 0.108649774484067 | X11: of:=[.G11]/[.$T11] -> 78.2278376285284 | Y11: of:=[.H11]/[.$T11] -> 95.6118015459792 | Z11: of:=SUM([.G11:.H11])/[.E11] -> 1600 | AA11: of:=[.G11]/[.E11] -> 720 | AB11: of:=[.H11]/[.E11] -> 880 | AD11: of:=[.N11]/[.E11] -> 200
A12: X200-32 | B12: fuelTank1-2 | C12: 2.5 | D12: 3.75 | E12: 2 | G12: 1440 | H12: 1760 | I12: heavyRocketry | J12: 0.2 | K12: 0.2 | L12: 2 | M12: 6 | N12: 200 | O12: 200 | R12: 2000 | T12: of:=[.D12]*PI()*[.C12]^2*0.25 -> 18.4077694546277 | U12: 16000 | V12: of:=[.U12]/1000/[.T12] -> 0.869198195872538 | W12: of:=[.E12]/[.$T12] -> 0.108649774484067 | X12: of:=[.G12]/[.$T12] -> 78.2278376285284 | Y12: of:=[.H12]/[.$T12] -> 95.6118015459792 | Z12: of:=SUM([.G12:.H12])/[.E12] -> 1600 | AA12: of:=[.G12]/[.E12] -> 720 | AB12: of:=[.H12]/[.E12] -> 880 | AD12: of:=[.N12]/[.E12] -> 100
A13: Jumbo-64 | B13: fuelTank3-2 | C13: 2.5 | D13: 7.5 | E13: 4 | G13: 2880 | H13: 3520 | I13: heavierRocketry | J13: 0.2 | K13: 0.2 | L13: 2 | M13: 6 | N13: 200 | O13: 200 | R13: 2000 | T13: of:=[.D13]*PI()*[.C13]^2*0.25 -> 36.8155389092554 | U13: 32000 | V13: of:=[.U13]/1000/[.T13] -> 0.869198195872538 | W13: of:=[.E13]/[.$T13] -> 0.108649774484067 | X13: of:=[.G13]/[.$T13] -> 78.2278376285284 | Y13: of:=[.H13]/[.$T13] -> 95.6118015459792 | Z13: of:=SUM([.G13:.H13])/[.E13] -> 1600 | AA13: of:=[.G13]/[.E13] -> 720 | AB13: of:=[.H13]/[.E13] -> 880 | AD13: of:=[.N13]/[.E13] -> 50
A14: Kerbodyne S3-3600 | B14: Size3SmallTank | C14: 3.75 | D14: 1.927 | E14: 2.25 | G14: 1620 | H14: 1980 | I14: veryHeavyRocketry | J14: 0.2 | K14: 0.3 | L14: 2 | M14: 6 | N14: 200 | O14: 200 | R14: 2000 | T14: of:=[.D14]*PI()*[.C14]^2*0.25 -> 21.2830630434405 | W14: of:=[.E14]/[.$T14] -> 0.105717865675987 | X14: of:=[.G14]/[.$T14] -> 76.1168632867103 | Y14: of:=[.H14]/[.$T14] -> 93.0317217948682 | Z14: of:=SUM([.G14:.H14])/[.E14] -> 1600 | AA14: of:=[.G14]/[.E14] -> 720 | AB14: of:=[.H14]/[.E14] -> 880 | AD14: of:=[.N14]/[.E14] -> 88.8888888888889
A15: Kerbodyne S3-7200 | B15: Size3MediumTank | C15: 3.75 | D15: 3.868 | E15: 4.5 | G15: 3240 | H15: 3960 | I15: veryHeavyRocketry | J15: 0.2 | K15: 0.3 | L15: 2 | M15: 6 | N15: 300 | O15: 300 | R15: 2000 | T15: of:=[.D15]*PI()*[.C15]^2*0.25 -> 42.7207513503 | W15: of:=[.E15]/[.$T15] -> 0.105335226038069 | X15: of:=[.G15]/[.$T15] -> 75.8413627474099 | Y15: of:=[.H15]/[.$T15] -> 92.694998913501 | Z15: of:=SUM([.G15:.H15])/[.E15] -> 1600 | AA15: of:=[.G15]/[.E15] -> 720 | AB15: of:=[.H15]/[.E15] -> 880 | AD15: of:=[.N15]/[.E15] -> 66.6666666666667
A16: Kerbodyne S3-14400 | B16: Size3LargeTank | C16: 3.75 | D16: 7.48 | E16: 9 | G16: 6480 | H16: 7920 | I16: veryHeavyRocketry | J16: 0.2 | K16: 0.3 | L16: 2 | M16: 6 | N16: 400 | O16: 400 | R16: 2000 | T16: of:=[.D16]*PI()*[.C16]^2*0.25 -> 82.6140693123691 | W16: of:=[.E16]/[.$T16] -> 0.108940281902474 | X16: of:=[.G16]/[.$T16] -> 78.4370029697812 | Y16: of:=[.H16]/[.$T16] -> 95.867448074177 | Z16: of:=SUM([.G16:.H16])/[.E16] -> 1600 | AA16: of:=[.G16]/[.E16] -> 720 | AB16: of:=[.H16]/[.E16] -> 880 | AD16: of:=[.N16]/[.E16] -> 44.4444444444444
A18: RCS propellant tanks | G18: RCS | X18: RCS/Vol
A19: Stratus-V Roundified | B19: radialRCSTank | E19: 0.075 | G19: 60 | I19: advFlightControl | J19: 0.2 | K19: 0.2 | L19: 2 | M19: 12 | R19: 2000 | Z19: of:=SUM([.G19:.H19])/[.E19] -> 800 | AD19: of:=[.N19]/[.E19] -> 0
A20: Stratus-V Cylindrified | B20: rcsTankRadialLong | E20: 0.15 | G20: 150 | I20: specializedControl | J20: 0.2 | K20: 0.2 | L20: 2 | M20: 12 | R20: 2000 | Z20: of:=SUM([.G20:.H20])/[.E20] -> 1000 | AD20: of:=[.N20]/[.E20] -> 0
A21: FL-R10 | B21: rcsTankMini | C21: 0.625 | D21: 0.375 | E21: 0.05 | G21: 80 | I21: precisionEngineering | J21: 0.2 | K21: 0.2 | L21: 2 | M21: 12 | N21: 50 | O21: 50 | R21: 2000 | T21: of:=[.D21]*PI()*[.C21]^2*0.25 -> 0.115048559091423 | W21: of:=[.E21]/[.$T21] -> 0.434599097936269 | X21: of:=[.G21]/[.$T21] -> 695.35855669803 | Z21: of:=SUM([.G21:.H21])/[.E21] -> 1600 | AD21: of:=[.N21]/[.E21] -> 1000
A22: FL-R25 | B22: RCSFuelTank | C22: 1.25 | D22: of:=2*0.2853027 -> 0.5706054 | E22: 0.15 | G22: 250 | I22: fuelSystems | J22: 0.2 | K22: 0.2 | L22: 2 | M22: 12 | R22: 2000 | T22: of:=[.D22]*PI()*[.C22]^2*0.25 -> 0.700238176851041 | W22: of:=[.E22]/[.$T22] -> 0.214212827804601 | X22: of:=[.G22]/[.$T22] -> 357.021379674335 | Z22: of:=SUM([.G22:.H22])/[.E22] -> 1666.66666666667 | AD22: of:=[.N22]/[.E22] -> 0
A23: FL-R1 | B23: RCSTank1-2 | C23: 2.5 | D23: 1 | E23: 0.4 | G23: 750 | I23: largeControl | J23: 0.2 | K23: 0.2 | L23: 2 | M23: 12 | R23: 2000 | T23: of:=[.D23]*PI()*[.C23]^2*0.25 -> 4.90873852123405 | W23: of:=[.E23]/[.$T23] -> 0.0814873308630504 | X23: of:=[.G23]/[.$T23] -> 152.78874536822 | Z23: of:=SUM([.G23:.H23])/[.E23] -> 1875 | AD23: of:=[.N23]/[.E23] -> 0
A25: Liquid fuel tanks | G25: Liq | X25: Lq/Vol
A26: Mk0 Fuselage | B26: miniFuselage | C26: 0.625 | D26: 0.9375 | E26: 0.03 | G26: 50 | I26: aerodynamicSystems | J26: 0.3 | K26: 0.2 | L26: 1 | M26: 10 | N26: 50 | O26: 50 | R26: 2000 | T26: of:=[.D26]*PI()*[.C26]^2*0.25 -> 0.287621397728558 | W26: of:=[.E26]/[.$T26] -> 0.104303783504705 | X26: of:=[.G26]/[.$T26] -> 173.839639174508 | Z26: of:=SUM([.G26:.H26])/[.E26] -> 1666.66666666667 | AD26: of:=[.N26]/[.E26] -> 1666.66666666667
A27: Mk1 Fuselage | B27: MK1Fuselage | C27: 1.25 | D27: 1.875 | E27: 0.25 | G27: 400 | I27: aerodynamicSystems | J27: 0.3 | K27: 0.2 | L27: 2 | M27: 20 | N27: 50 | O27: 50 | R27: 2000 | T27: of:=[.D27]*PI()*[.C27]^2*0.25 -> 2.30097118182846 | W27: of:=[.E27]/[.$T27] -> 0.108649774484067 | X27: of:=[.G27]/[.$T27] -> 173.839639174508 | Z27: of:=SUM([.G27:.H27])/[.E27] -> 1600 | AD27: of:=[.N27]/[.E27] -> 200
A28: Mk2 Fuselage Short | B28: mk2FuselageShortLiquid | C28: 1.25 | D28: 1.875 | E28: 0.29 | G28: 400 | I28: supersonicFlight | J28: 0.3 | K28: 0.2 | L28: 1 | M28: 50 | N28: 50 | O28: 50 | R28: 2500 | Z28: of:=SUM([.G28:.H28])/[.E28] -> 1379.31034482759 | AD28: of:=[.N28]/[.E28] -> 172.413793103448
A29: Mk2 Fuselage | B29: mk2Fuselage | C29: 1.25 | D29: 3.75 | E29: 0.57 | G29: 800 | I29: supersonicFlight | J29: 0.3 | K29: 0.2 | L29: 1 | M29: 50 | N29: 50 | O29: 50 | R29: 2500 | Z29: of:=SUM([.G29:.H29])/[.E29] -> 1403.50877192982 | AD29: of:=[.N29]/[.E29] -> 87.719298245614
A30: Mk3 | B30: mk3FuselageLF_50 | E30: 3.57 | G30: 5000 | I30: heavyAerodynamics | J30: 0.3 | K30: 0.2 | L30: 1 | M30: 50 | N30: 300 | O30: 300 | R30: 2700 | Z30: of:=SUM([.G30:.H30])/[.E30] -> 1400.56022408964 | AD30: of:=[.N30]/[.E30] -> 84.0336134453782
A32: Spaceplane mixed fuel tanks
A33: Mk2 LFO Short | B33: mk2FuselageShortLFO | C33: 1.25 | D33: 1.875 | E33: 0.29 | G33: 180 | H33: 220 | I33: supersonicFlight | J33: 0.3 | K33: 0.2 | L33: 1 | M33: 50 | N33: 50 | O33: 50 | R33: 2500 | Z33: of:=SUM([.G33:.H33])/[.E33] -> 1379.31034482759 | AD33: of:=[.N33]/[.E33] -> 172.413793103448
A34: Mk2 LFO Fuselage | B34: mk2FuselageLongLFO | C34: 1.25 | D34: 3.75 | E34: 0.57 | G34: 360 | H34: 440 | I34: supersonicFlight | J34: 0.3 | K34: 0.2 | L34: 1 | M34: 50 | N34: 50 | O34: 50 | R34: 2500 | Z34: of:=SUM([.G34:.H34])/[.E34] -> 1403.50877192982 | AD34: of:=[.N34]/[.E34] -> 87.719298245614
A35: Mk2->Mk1 | B35: mk2SpacePlaneAdapter | C35: 1.25 | D35: 1.875 | E35: 0.29 | G35: 180 | H35: 220 | I35: supersonicFlight | J35: 0.2 | K35: 0.1 | L35: 2 | M35: 50 | N35: 50 | O35: 50 | R35: 2500 | Z35: of:=SUM([.G35:.H35])/[.E35] -> 1379.31034482759 | AD35: of:=[.N35]/[.E35] -> 172.413793103448
A36: Mk3->Mk2 | B36: adapterMk3-Mk2 | E36: 1.43 | G36: 900 | H36: 1100 | I36: heavyAerodynamics | J36: 0.3 | K36: 0.2 | L36: 1 | M36: 50 | N36: 300 | O36: 300 | R36: 2600 | Z36: of:=SUM([.G36:.H36])/[.E36] -> 1398.6013986014 | AD36: of:=[.N36]/[.E36] -> 209.79020979021
A38: Xenon tanks | G38: Xenon
A39: PB-X150R | B39: xenonTankRadial | C39: 0.3 | D39: 0.525 | E39: 0.03143 | G39: 400 | I39: ionPropulsion | J39: 0.2 | K39: 0.2 | L39: 2 | M39: 12 | R39: 2000 | T39: of:=[.D39]*PI()*[.C39]^2*0.25 -> 0.0371100632205294 | W39: of:=[.E39]/[.$T39] -> 0.84694008234976 | X39: of:=[.G39]/[.$T39] -> 10778.7474686575 | Z39: of:=SUM([.G39:.H39])/[.E39] -> 12726.6942411709
A40: PB-X150 | B40: xenonTank | C40: 0.625 | D40: of:=0.1404661*2 -> 0.2809322 | E40: 0.055 | G40: 700 | I40: ionPropulsion | J40: 0.3 | K40: 0.2 | L40: 2 | M40: 6 | N40: 50 | O40: 50 | R40: 2000 | T40: of:=[.D40]*PI()*[.C40]^2*0.25 -> 0.0861889194996893 | W40: of:=[.E40]/[.$T40] -> 0.638133072316776 | X40: of:=[.G40]/[.$T40] -> 8121.69364766806 | Z40: of:=SUM([.G40:.H40])/[.E40] -> 12727.2727272727
A41: ^ - Bag Only | B41: <-- see note
A42: PB-X750 | B42: xenonTankLarge | C42: 1.25 | E42: 0.4125 | G42: 5250 | I42: ionPropulsion | J42: 0.3 | K42: 0.2 | L42: 2 | M42: 6 | N42: 50 | O42: 50 | R42: 2000 | T42: of:=[.D42]*PI()*[.C42]^2*0.25 -> 0 | W42: of:=[.E42]/[.$T42] ->  | X42: of:=[.G42]/[.$T42] ->  | Z42: of:=SUM([.G42:.H42])/[.E42] -> 12727.2727272727
A44: SRBs | G44: Dry fuel | X44: Dry/Vol | Y44: thrust1m | AA44: heatFactor | AB44: TWR Wet | AC44: TWR Dry
A45: RT-10 | B45: solidBooster | C45: 1.25 | D45: of:=2.4 -> 2.4 | E45: 0.5 | F45: of:=[.E45]+[.G45]*0.0075 -> 3.7475 | G45: 433 | I45: start | J45: 0.3 | L45: 2 | M45: 7 | P45: 250 | Q45: 550 | R45: 3600 | T45: of:=[.D45]*PI()*[.C45]^2*0.25 -> 2.94524311274043 | W45: of:=[.E45]/[.$T45] -> 0.169765272631355 | X45: of:=[.G45]/[.$T45] -> 147.016726098753 | Y45: of:=[.P45]/[.C45]^2 -> 160 | Z45: of:=SUM([.G45:.H45])/[.E45] -> 866 | AA45: of:=([.Q45]*(1+[.E45]))/[.P45]^(1/2) -> 52.1775813927783 | AB45: of:=[.P45]/[.F45] -> 66.711140760507 | AC45: of:=[.P45]/[.E45] -> 500 | AD45: of:=[.N45]/[.E45] -> 0
A46: BACC | B46: solidBooster1-1 | C46: 1.25 | D46: 7.1 | E46: 1.5 | F46: of:=[.E46]+[.G46]*0.0075 -> 7.875 | G46: 850 | I46: generalRocketry | J46: 0.3 | L46: 2 | M46: 7 | P46: 315 | Q46: 400 | R46: 3900 | T46: of:=[.D46]*PI()*[.C46]^2*0.25 -> 8.71301087519044 | W46: of:=[.E46]/[.$T46] -> 0.172156332809261 | X46: of:=[.G46]/[.$T46] -> 97.5552552585815 | Y46: of:=[.P46]/[.C46]^2 -> 201.6 | Z46: of:=SUM([.G46:.H46])/[.E46] -> 566.666666666667 | AA46: of:=([.Q46]*(1+[.E46]))/[.P46]^(1/2) -> 56.3436169819011 | AB46: of:=[.P46]/[.F46] -> 40 | AC46: of:=[.P46]/[.E46] -> 210 | AD46: of:=[.N46]/[.E46] -> 0
A47: S1 SRB-KD25k | B47: MassiveBooster | C47: 1.25 | D47: 14.9 | E47: 3 | F47: of:=[.E47]+[.G47]*0.0075 -> 21.75 | G47: 2500 | I47: heavyRocketry | J47: 0.3 | K47: 0.2 | L47: 2 | M47: 7 | N47: 200 | O47: 200 | P47: 650 | Q47: 400 | R47: 3900 | T47: of:=[.D47]*PI()*[.C47]^2*0.25 -> 18.2850509915968 | W47: of:=[.E47]/[.$T47] -> 0.164068451402115 | X47: of:=[.G47]/[.$T47] -> 136.723709501762 | Y47: of:=[.P47]/[.C47]^2 -> 416 | Z47: of:=SUM([.G47:.H47])/[.E47] -> 833.333333333333 | AA47: of:=([.Q47]*(1+[.E47]))/[.P47]^(1/2) -> 62.7571632442189 | AB47: of:=[.P47]/[.F47] -> 29.8850574712644 | AC47: of:=[.P47]/[.E47] -> 216.666666666667 | AD47: of:=[.N47]/[.E47] -> 66.6666666666667
A48: Sepratron I | B48: sepMotor1 | C48: 0.15 | D48: 0.5 | E48: 0.0125 | F48: of:=[.E48]+[.G48]*0.0075 -> 0.0725 | G48: 8 | I48: generalRocketry | J48: 0.3 | L48: 2 | M48: 7 | P48: 18 | Q48: 550 | R48: 3600 | T48: of:=[.D48]*PI()*[.C48]^2*0.25 -> 0.00883572933822129 | W48: of:=[.E48]/[.$T48] -> 1.41471060526129 | X48: of:=[.G48]/[.$T48] -> 905.414787367227 | Y48: of:=[.P48]/[.C48]^2 -> 800 | Z48: of:=SUM([.G48:.H48])/[.E48] -> 640 | AA48: of:=([.Q48]*(1+[.E48]))/[.P48]^(1/2) -> 131.256696257753 | AB48: of:=[.P48]/[.F48] -> 248.275862068965 | AC48: of:=[.P48]/[.E48] -> 1440 | AD48: of:=[.N48]/[.E48] -> 0
A50: SRBs - RF Stock | G50: Dry fuel | X50: Dry/Vol | AA50: heat/thrust | AB50: TWR Wet | AC50: TWR Dry
A51: RT-10 | C51: 1.25 | D51: of:=2.4 -> 2.4 | E51: 0.15625 | F51: of:=[.E51]+[.G51]*0.0075 -> 13.83625 | G51: 1824 | I51: start | J51: 0.3 | L51: 2 | M51: 7 | P51: 250 | Q51: 215 | R51: 2220 | T51: of:=[.D51]*PI()*[.C51]^2*0.25 -> 2.94524311274043 | W51: of:=[.E51]/[.$T51] -> 0.0530516476972985 | X51: of:=[.G51]/[.$T51] -> 619.303714559183 | Z51: of:=SUM([.G51:.H51])/[.E51] -> 11673.6 | AA51: of:=([.Q51]*[.F51])/[.P51] -> 11.899175 | AB51: of:=[.P51]/[.F51] -> 18.0684795374469 | AC51: of:=[.P51]/[.E51] -> 1600 | AD51: of:=[.N51]/[.E51] -> 0
A52: BACC | C52: 1.25 | D52: 7.1 | E52: 0.46875 | F52: of:=[.E52]+[.G52]*0.0075 -> 27.32625 | G52: 3581 | I52: generalRocketry | J52: 0.3 | L52: 2 | M52: 7 | P52: 315 | Q52: 187 | R52: 1996 | T52: of:=[.D52]*PI()*[.C52]^2*0.25 -> 8.71301087519044 | W52: of:=[.E52]/[.$T52] -> 0.0537988540028942 | X52: of:=[.G52]/[.$T52] -> 410.994551859977 | Z52: of:=SUM([.G52:.H52])/[.E52] -> 7639.46666666667 | AA52: of:=([.Q52]*[.F52])/[.P52] -> 16.22225 | AB52: of:=[.P52]/[.F52] -> 11.5273775216138 | AC52: of:=[.P52]/[.E52] -> 672 | AD52: of:=[.N52]/[.E52] -> 0
A53: Sepatron | C53: 0.15 | D53: 0.5 | E53: 0.00390625 | F53: of:=[.E53]+[.G53]*0.0075 -> 0.25890625 | G53: 34 | I53: generalRocketry | J53: 0.3 | L53: 2 | M53: 7 | P53: 18 | Q53: 550 | R53: 3600 | T53: of:=[.D53]*PI()*[.C53]^2*0.25 -> 0.00883572933822129 | W53: of:=[.E53]/[.$T53] -> 0.442097064144154 | X53: of:=[.G53]/[.$T53] -> 3848.01284631071 | Z53: of:=SUM([.G53:.H53])/[.E53] -> 8704 | AA53: of:=([.Q53]*[.F53])/[.P53] -> 7.91102430555556 | AB53: of:=[.P53]/[.F53] -> 69.5232347616174 | AC53: of:=[.P53]/[.E53] -> 4608 | AD53: of:=[.N53]/[.E53] -> 0

Sheet: Decouplers
P1: mass = c * area | S1: max Force = c * dia | W1: Failed: mass = c * dia^3 (ie: fixed aspect ratio) | Z1: Failed! Mass = c1 * area * ends + c2 * force | AF1: Failed! Mass = dens * vol
B2: name | C2: length | D2: dia | E2: mass | F2: sides | G2: force | H2: Impulse | I2: Tech | L2: Vol | M2: Density | N2: area | P2: mass/area | Q2: fit | S2: maxForce | T2: impulse | W2: mass/dia^3 | Z2: m/force | AA2: m/aparatus | AB2: mass/area/aparatus | AC2: calc mass | AD2: Fit | AF2: vol*av dens | AG2: Fit
A3: TR-2V | C3: of:=0.07590994+0.07590994 -> 0.15181988 | D3: 0.625 | E3: 0.015 | F3: 1 | G3: 15 | H3: of:=[.G3]*0.02 -> 0.3 | I3: precisionEngineering | L3: of:=2*PI()*([.D3]/2)*[.C3] -> 0.298097637298052 | M3: of:=[.E3]/[.L3] -> 0.0503190838275658 | N3: of:=PI()*([.D3]/2)^2 -> 0.306796157577128 | P3: of:=[.E3]/[.N3] -> 0.0488923985178302 | Q3: of:=[.P3]/[.P$12] -> 0.741539970573811 | S3: of:=[.S$12]*[.D3] -> 250 | T3: of:=[.S3]*0.02 -> 5 | U3: of:=[.G3]/[.S3] -> 0.06 | W3: of:=[.E3]/[.D3]^3 -> 0.06144 | X3: of:=[.W3]/[.W$12] -> 1.5530257639305 | Z3: of:=[.G3]*[.Z$12] -> 0.0015 | AA3: of:=([.E3]-[.Z3])/[.F3] -> 0.0135 | AB3: of:=[.AA3]/[.N3] -> 0.0440031586660472 | AC3: of:=[.N3]*[.AB$12]*[.F3]+[.G3]*[.Z$12] -> 0.0147599206349206 | AD3: of:=[.AC3]/[.E3] -> 0.983994708994709 | AF3: of:=[.L3]*[.M$12] -> 0.0185900668279078 | AG3: of:=[.AF3]/[.E3] -> 1.23933778852719
A4: TR-18A | C4: of:=0.0650517+0.1329949 -> 0.1980466 | D4: 1.25 | E4: 0.05 | F4: 1 | G4: 250 | H4: of:=[.G4]*0.02 -> 5 | I4: basicRocketry | L4: of:=2*PI()*([.D4]/2)*[.C4] -> 0.777727179535546 | M4: of:=[.E4]/[.L4] -> 0.0642898966574111 | N4: of:=PI()*([.D4]/2)^2 -> 1.22718463030851 | P4: of:=[.E4]/[.N4] -> 0.0407436654315252 | Q4: of:=[.P4]/[.P$12] -> 0.617949975478176 | S4: of:=[.S$12]*[.D4] -> 500 | T4: of:=[.S4]*0.02 -> 10 | U4: of:=[.G4]/[.S4] -> 0.5 | W4: of:=[.E4]/[.D4]^3 -> 0.0256 | X4: of:=[.W4]/[.W$12] -> 0.647094068304374 | Z4: of:=[.G4]*[.Z$12] -> 0.025 | AA4: of:=([.E4]-[.Z4])/[.F4] -> 0.025 | AB4: of:=[.AA4]/[.N4] -> 0.0203718327157626 | AC4: of:=[.N4]*[.AB$12]*[.F4]+[.G4]*[.Z$12] -> 0.0780396825396825 | AD4: of:=[.AC4]/[.E4] -> 1.56079365079365 | AF4: of:=[.L4]*[.M$12] -> 0.0485008884085526 | AG4: of:=[.AF4]/[.E4] -> 0.970017768171051
A5: Rocomax | C5: of:=0.4508572+0.3654699 -> 0.8163271 | D5: 2.5 | E5: 0.4 | F5: 1 | G5: 250 | H5: of:=[.G5]*0.02 -> 5 | I5: advConstruction | L5: of:=2*PI()*([.D5]/2)*[.C5] -> 6.41141805071565 | M5: of:=[.E5]/[.L5] -> 0.0623886941759088 | N5: of:=PI()*([.D5]/2)^2 -> 4.90873852123405 | P5: of:=[.E5]/[.N5] -> 0.0814873308630504 | Q5: of:=[.P5]/[.P$12] -> 1.23589995095635 | S5: of:=[.S$12]*[.D5] -> 1000 | T5: of:=[.S5]*0.02 -> 20 | U5: of:=[.G5]/[.S5] -> 0.25 | W5: of:=[.E5]/[.D5]^3 -> 0.0256 | X5: of:=[.W5]/[.W$12] -> 0.647094068304374 | Z5: of:=[.G5]*[.Z$12] -> 0.025 | AA5: of:=([.E5]-[.Z5])/[.F5] -> 0.375 | AB5: of:=[.AA5]/[.N5] -> 0.0763943726841098 | AC5: of:=[.N5]*[.AB$12]*[.F5]+[.G5]*[.Z$12] -> 0.23715873015873 | AD5: of:=[.AC5]/[.E5] -> 0.592896825396825 | AF5: of:=[.L5]*[.M$12] -> 0.399831045642564 | AG5: of:=[.AF5]/[.E5] -> 0.999577614106411
A6: TR-38-D | B6: size3Decoupler | C6: 0.8707079 | D6: 3.75 | E6: 0.8 | F6: 1 | G6: 100 | H6: of:=[.G6]*0.02 -> 2 | I6: veryHeavyRocketry | L6: of:=2*PI()*([.D6]/2)*[.C6] -> 10.2577857827347 | M6: of:=[.E6]/[.L6] -> 0.0779895405250625 | N6: of:=PI()*([.D6]/2)^2 -> 11.0446616727766 | P6: of:=[.E6]/[.N6] -> 0.0724331829893781 | Q6: of:=[.P6]/[.P$12] -> 1.09857773418342 | S6: of:=[.S$12]*[.D6] -> 1500 | T6: of:=[.S6]*0.02 -> 30 | U6: of:=[.G6]/[.S6] -> 0.0666666666666667 | W6: of:=[.E6]/[.D6]^3 -> 0.0151703703703704 | X6: of:=[.W6]/[.W$12] -> 0.383463151587777 | Z6: of:=[.G6]*[.Z$12] -> 0.01 | AA6: of:=([.E6]-[.Z6])/[.F6] -> 0.79 | AB6: of:=[.AA6]/[.N6] -> 0.0715277682020109 | AC6: of:=[.N6]*[.AB$12]*[.F6]+[.G6]*[.Z$12] -> 0.487357142857143 | AD6: of:=[.AC6]/[.E6] -> 0.609196428571429 | AF6: of:=[.L6]*[.M$12] -> 0.639699545879785 | AG6: of:=[.AF6]/[.E6] -> 0.799624432349731
A8: TR-2C | C8: of:=0.07590994*2 -> 0.15181988 | D8: 0.625 | E8: 0.02 | F8: 2 | G8: 15 | H8: of:=[.G8]*0.02 -> 0.3 | I8: advMetalworks | L8: of:=2*PI()*([.D8]/2)*[.C8] -> 0.298097637298052 | M8: of:=[.E8]/[.L8] -> 0.0670921117700877 | N8: of:=PI()*([.D8]/2)^2 -> 0.306796157577128 | P8: of:=[.E8]/[.N8] -> 0.0651898646904403 | Q8: of:=[.P8]/[.P$12] -> 0.988719960765081 | S8: of:=[.S$12]*[.D8] -> 250 | T8: of:=[.S8]*0.02 -> 5 | U8: of:=[.G8]/[.S8] -> 0.06 | W8: of:=[.E8]/[.D8]^3 -> 0.08192 | X8: of:=[.W8]/[.W$12] -> 2.070701018574 | Z8: of:=[.G8]*[.Z$12] -> 0.0015 | AA8: of:=([.E8]-[.Z8])/[.F8] -> 0.00925 | AB8: of:=[.AA8]/[.N8] -> 0.0301503124193286 | AC8: of:=[.N8]*[.AB$12]*[.F8]+[.G8]*[.Z$12] -> 0.0280198412698413 | AD8: of:=[.AC8]/[.E8] -> 1.40099206349206 | AF8: of:=[.L8]*[.M$12] -> 0.0185900668279078 | AG8: of:=[.AF8]/[.E8] -> 0.929503341395389
A9: TR-18D | C9: of:=0.1833064*2 -> 0.3666128 | D9: 1.25 | E9: 0.075 | F9: 2 | G9: 250 | H9: of:=[.G9]*0.02 -> 5 | I9: advMetalworks | L9: of:=2*PI()*([.D9]/2)*[.C9] -> 1.43968509898998 | M9: of:=[.E9]/[.L9] -> 0.0520947254733807 | N9: of:=PI()*([.D9]/2)^2 -> 1.22718463030851 | P9: of:=[.E9]/[.N9] -> 0.0611154981472878 | Q9: of:=[.P9]/[.P$12] -> 0.926924963217263 | S9: of:=[.S$12]*[.D9] -> 500 | T9: of:=[.S9]*0.02 -> 10 | U9: of:=[.G9]/[.S9] -> 0.5 | W9: of:=[.E9]/[.D9]^3 -> 0.0384 | X9: of:=[.W9]/[.W$12] -> 0.970641102456561 | Z9: of:=[.G9]*[.Z$12] -> 0.025 | AA9: of:=([.E9]-[.Z9])/[.F9] -> 0.025 | AB9: of:=[.AA9]/[.N9] -> 0.0203718327157626 | AC9: of:=[.N9]*[.AB$12]*[.F9]+[.G9]*[.Z$12] -> 0.131079365079365 | AD9: of:=[.AC9]/[.E9] -> 1.74772486772487 | AF9: of:=[.L9]*[.M$12] -> 0.0897821346185545 | AG9: of:=[.AF9]/[.E9] -> 1.19709512824739
A10: TR-XL | C10: 0.2 | D10: 2.5 | E10: 0.45 | F10: 2 | G10: 600 | H10: of:=[.G10]*0.02 -> 12 | I10: advMetalworks | L10: of:=2*PI()*([.D10]/2)*[.C10] -> 1.5707963267949 | M10: of:=[.E10]/[.L10] -> 0.286478897565412 | N10: of:=PI()*([.D10]/2)^2 -> 4.90873852123405 | P10: of:=[.E10]/[.N10] -> 0.0916732472209317 | Q10: of:=[.P10]/[.P$12] -> 1.3903874448259 | S10: of:=[.S$12]*[.D10] -> 1000 | T10: of:=[.S10]*0.02 -> 20 | U10: of:=[.G10]/[.S10] -> 0.6 | W10: of:=[.E10]/[.D10]^3 -> 0.0288 | X10: of:=[.W10]/[.W$12] -> 0.727980826842421 | Z10: of:=[.G10]*[.Z$12] -> 0.06 | AA10: of:=([.E10]-[.Z10])/[.F10] -> 0.195 | AB10: of:=[.AA10]/[.N10] -> 0.0397250737957371 | AC10: of:=[.N10]*[.AB$12]*[.F10]+[.G10]*[.Z$12] -> 0.48431746031746 | AD10: of:=[.AC10]/[.E10] -> 1.07626102292769 | AF10: of:=[.L10]*[.M$12] -> 0.0979585378563481 | AG10: of:=[.AF10]/[.E10] -> 0.217685639680774
M12: of:=AVERAGE([.M3:.M9]) -> 0.0623623420715694 | O12: Avg | P12: of:=AVERAGE([.P3:.P10]) -> 0.0659335982657777 | Q12: of:=AVERAGE([.Q3:.Q10]) -> 1 | S12: of:=500/1.25 -> 400 | T12: of:=10/1.25 -> 8 | W12: of:=AVERAGE([.W3:.W10]) -> 0.0395614814814815 | X12: of:=AVERAGE([.X3:.X10]) -> 1 | Z12: 0.0001 | AB12: of:=AVERAGE([.AB3:.AB10]) -> 0.0432206215998227 | AD12: of:=AVERAGE([.AD3:.AD10]) -> 1.13883708112875 | AG12: of:=AVERAGE([.AG3:.AG10]) -> 0.907548816068277
O13: StDev | Q13: of:=STDEV([.Q3:.Q10]) -> 0.269567468966396 | X13: of:=STDEV([.X3:.X10]) -> 0.599485532335657 | AD13: of:=STDEV([.AD3:.AD10]) -> 0.451659684767426 | AG13: of:=STDEV([.AG3:.AG10]) -> 0.340179740408373
O15: Density | P15: of:=[.P12]/0.2 -> 0.329667991328888

Sheet: Structural
B1: Diameter | G1: Drag | K1: Break
B2: Bottom (Width) | C2: Top (Depth) | D2: Len | E2: Mass | F2: tech | G2: max | H2: min | I2: ang | J2: crash | K2: force | L2: torque | M2: thrust | N2: heat | O2: max temp | Q2: Vol | R2: Dens | S2: Aspect
A3: Structural Fuselage
A4: Structural Fuselage | B4: 1.25 | C4: 1.25 | D4: of:=0.75*2*1.25 -> 1.875 | E4: 0.4 | F4: advConstruction | G4: 0.2 | I4: 2 | J4: 70 | K4: 50 | L4: 50 | O4: 3000 | Q4: of:=[.D4]*PI()*[.B4]^2*0.25 -> 2.30097118182846 | R4: of:=[.E4]/[.$Q4] -> 0.173839639174508
A6: Nose Cones
A7: noseCone | B7: 1.25 | C7: 0 | D7: 0.565 | E7: 0.03 | F7: stability | G7: 0.1 | H7: 0.1 | I7: 0.5 | J7: 10 | K7: ? | L7: ? | O7: 3400 | Q7: of:=(((([.B7]/2)^2)+(([.B7]/2)*([.C7]/2))+(([.C7]/2)^2))*[.D7]*3.14159265)/3 -> 0.231119771777344 | R7: of:=[.E7]/[.$Q7] -> 0.129802828071764
A8: rocketNoseCone | B8: 2.5 | C8: 0 | D8: 2.095 | E8: 0.4 | F8: heavyAerodynamics | G8: 0.1 | H8: 0.1 | I8: 0.5 | J8: 10 | K8: ? | L8: ? | O8: 3400 | Q8: of:=(((([.B8]/2)^2)+(([.B8]/2)*([.C8]/2))+(([.C8]/2)^2))*[.D8]*3.14159265)/3 -> 3.42793573007813 | R8: of:=[.E8]/[.$Q8] -> 0.116688302085198
A9: standardNoseCone | B9: 0.625 | C9: 0 | D9: 0.415 | E9: 0.1 | F9: advAerodynamics | G9: 0.1 | H9: 0.1 | I9: 0.25 | J9: 40 | K9: ? | L9: ? | O9: 3400 | Q9: of:=(((([.B9]/2)^2)+(([.B9]/2)*([.C9]/2))+(([.C9]/2)^2))*[.D9]*3.14159265)/3 -> 0.0424401350830078 | R9: of:=[.E9]/[.$Q9] -> 2.35626017222641
A11: Adapters
A12: noseConeAdapter | B12: 1.25 | C12: 0.625 | D12: 0.995 | E12: 0.3 | F12: advAerodynamics | G12: 0.1 | H12: 0.1 | I12: 1 | J12: 20 | K12: ? | L12: ? | O12: 3400 | Q12: of:=(((([.B12]/2)^2)+(([.B12]/2)*([.C12]/2))+(([.C12]/2)^2))*[.D12]*3.14159265)/3 -> 0.712278411694336 | R12: of:=[.E12]/[.$Q12] -> 0.421183620161074
A13: adapterSmallMiniShort | B13: 1.25 | C13: 0.625 | D13: 0.1875 | E13: 0.04 | F13: specializedConstruction | G13: 0.2 | H13: 0.2 | I13: 2 | J13: 6 | K13: 50 | L13: 50 | O13: 2900 | Q13: of:=(((([.B13]/2)^2)+(([.B13]/2)*([.C13]/2))+(([.C13]/2)^2))*[.D13]*3.14159265)/3 -> 0.134223318786621 | R13: of:=[.E13]/[.$Q13] -> 0.298010810353968
A14: adapterSmallMiniTall | B14: 1.25 | C14: 0.625 | D14: 0.6875 | E14: 0.05 | F14: specializedConstruction | G14: 0.2 | H14: 0.2 | I14: 0.2 | J14: 6 | K14: 50 | L14: 50 | O14: 2900 | Q14: of:=(((([.B14]/2)^2)+(([.B14]/2)*([.C14]/2))+(([.C14]/2)^2))*[.D14]*3.14159265)/3 -> 0.492152168884277 | R14: of:=[.E14]/[.$Q14] -> 0.101594594438853
A15: largeAdapter | B15: 2.5 | C15: 1.25 | D15: 1.255 | E15: 0.1 | F15: advConstruction | G15: 0.2 | H15: 0.3 | I15: 2 | J15: 6 | K15: 200 | L15: 200 | O15: 2900 | Q15: of:=(((([.B15]/2)^2)+(([.B15]/2)*([.C15]/2))+(([.C15]/2)^2))*[.D15]*3.14159265)/3 -> 3.59360565498047 | R15: of:=[.E15]/[.$Q15] -> 0.0278272046520762
A16: largeAdapter2 | B16: 2.5 | C16: 1.25 | D16: 0.3785 | E16: 0.08 | F16: advConstruction | G16: 0.2 | H16: 0.3 | I16: 2 | J16: 6 | K16: 200 | L16: 200 | O16: 2900 | Q16: of:=(((([.B16]/2)^2)+(([.B16]/2)*([.C16]/2))+(([.C16]/2)^2))*[.D16]*3.14159265)/3 -> 1.0838085580957 | R16: of:=[.E16]/[.$Q16] -> 0.0738137740308707
A17: Size3to2Adapter | B17: 3.75 | C17: 2.5 | D17: 2.2 | E17: 0.2 | F17: veryHeavyRocketry | G17: 0.2 | H17: 0.3 | I17: 2 | J17: 6 | K17: 200 | L17: 200 | O17: 2900 | Q17: of:=(((([.B17]/2)^2)+(([.B17]/2)*([.C17]/2))+(([.C17]/2)^2))*[.D17]*3.14159265)/3 -> 17.0987724960938 | R17: of:=[.E17]/[.$Q17] -> 0.0116967460702627
A18: trussAdapter | B18: 1.25 | C18: 0.655 | D18: 1.06 | E18: 0.25 | F18: specializedConstruction | G18: 0.2 | H18: 0.2 | I18: 1 | J18: 80 | K18: 200 | L18: 200 | O18: 5000 | Q18: of:=(((([.B18]/2)^2)+(([.B18]/2)*([.C18]/2))+(([.C18]/2)^2))*[.D18]*3.14159265)/3 -> 0.779871970128956 | R18: of:=[.E18]/[.$Q18] -> 0.320565438399666
A20: Trusses
A21: trussPiece1x | B21: 0.655 | C21: 0.655 | D21: 1.1185 | E21: 0.125 | F21: start | G21: 0.2 | H21: 0.2 | I21: 1 | J21: 80 | K21: 200 | L21: 200 | O21: 5000 | Q21: of:=[.B21]*[.C21]*[.D21] -> 0.4798644625 | R21: of:=[.E21]/[.$Q21] -> 0.260490221236168
A22: trussPiece3x | B22: 0.655 | C22: 0.655 | D22: 2.9505 | E22: 0.375 | F22: advMetalworks | G22: 0.2 | H22: 0.2 | I22: 1 | J22: 80 | K22: 200 | L22: 200 | O22: 5000 | Q22: of:=[.B22]*[.C22]*[.D22] -> 1.2658382625 | R22: of:=[.E22]/[.$Q22] -> 0.296246377684448
A24: I-Beams
A25: structuralIBeam1 | B25: 0.55 | C25: 0.225 | D25: 1.0575 | E25: 0.08 | F25: composites | G25: 0.2 | H25: 0.2 | I25: 1 | J25: 80 | K25: 200 | L25: 200 | O25: 3200 | Q25: 0
A26: structuralIBeam2 | B26: 0.25 | C26: 0.25 | D26: 3.1965 | E26: 0.375 | F26: composites | G26: 0.2 | H26: 0.2 | I26: 1 | J26: 80 | K26: 200 | L26: 200 | O26: 3200 | Q26: 0
A27: structuralIBeam3 | B27: 0.25 | C27: 0.25 | D27: 1.605 | E27: 0.1875 | F27: composites | G27: 0.2 | H27: 0.2 | I27: 1 | J27: 80 | K27: 200 | L27: 200 | O27: 3200 | Q27: 0
A29: Structural Cubes
A30: strutCube | B30: 0.215 | C30: 0.215 | D30: 0.2575 | E30: 0.001 | F30: composites | G30: 0.2 | H30: 0.2 | I30: 2 | J30: 7 | K30: ? | L30: ? | O30: 3000 | Q30: of:=[.B30]*[.C30]*[.D30] -> 0.0119029375 | R30: of:=[.E30]/[.$Q30] -> 0.0840128749730896
A31: strutOcto | B31: 0.56 | C31: 0.56 | D31: 0.2575 | E31: 0.001 | F31: composites | G31: 0.2 | H31: 0.2 | I31: 2 | J31: 7 | K31: ? | L31: ? | O31: 3000 | Q31: 0.066909 | R31: of:=[.E31]/[.$Q31] -> 0.0149456724805333
A33: Structural Panels
A34: structuralPanel1 | B34: 1 | C34: 1 | D34: 0.055 | E34: 0.075 | F34: composites | G34: 0.2 | H34: 0.2 | I34: 1 | J34: 80 | K34: 200 | L34: 200 | O34: 3200 | Q34: of:=[.B34]*[.C34]*[.D34] -> 0.055 | R34: of:=[.E34]/[.$Q34] -> 1.36363636363636
A35: structuralPanel2 | B35: 2 | C35: 2 | D35: 0.055 | E35: 0.3 | F35: composites | G35: 0.2 | H35: 0.2 | I35: 1 | J35: 80 | K35: 200 | L35: 200 | O35: 3200 | Q35: of:=[.B35]*[.C35]*[.D35] -> 0.22 | R35: of:=[.E35]/[.$Q35] -> 1.36363636363636

Sheet: Electrics
A1: Name | B1: Part | G1: Drag
C2: tech | D2: Dia | E2: Len | F2: Mass | G2: max | H2: min | I2: ang | J2: crash | K2: max temp | M2: Charge | O2: Vol | P2: Dens | Q2: Unit/mass
A3: Batteries
A4: Z-100 | B4: batteryPack | C4: scienceTech | F4: 0.005 | G4: 0.2 | H4: 0.2 | I4: 1 | J4: 8 | K4: 3200 | M4: 100 | O4: 0.004 | P4: of:=[.F4]/[.O4] -> 1.25 | Q4: of:=[.M4]/[.F4] -> 20000
A5: Z-200 | B5: batteryBankMini | C5: electrics | D5: 0.625 | E5: 0.2 | F5: 0.01 | G5: 0.2 | H5: 0.2 | I5: 1 | J5: 8 | K5: 3200 | M5: 200 | O5: of:=PI()*([.D5]/2)^2*[.E5] -> 0.0613592315154257 | P5: of:=[.F5]/[.O5] -> 0.162974661726101 | Q5: of:=[.M5]/[.F5] -> 20000
A6: Z-400 | B6: ksp_r_largeBatteryPack | C6: advElectrics | F6: 0.02 | G6: 0.2 | H6: 0.2 | I6: 1 | J6: 8 | K6: 3200 | M6: 400 | O6: 0.043 | P6: of:=[.F6]/[.O6] -> 0.465116279069768 | Q6: of:=[.M6]/[.F6] -> 20000
A7: Z-1k | B7: batteryBank | C7: largeElectrics | D7: 1.25 | E7: of:=0.1108553*2 -> 0.2217106 | F7: 0.05 | G7: 0.2 | H7: 0.2 | I7: 1 | J7: 8 | K7: 3200 | M7: 1000 | O7: of:=PI()*([.D7]/2)^2*[.E7] -> 0.272079840696479 | P7: of:=[.F7]/[.O7] -> 0.183769587162387 | Q7: of:=[.M7]/[.F7] -> 20000
A8: Z-4k | B8: batteryBankLarge | C8: specializedElectrics | D8: 2.5 | E8: 0.25 | F8: 0.2 | G8: 0.2 | H8: 0.2 | I8: 1 | J8: 8 | K8: 3200 | M8: 4000 | O8: of:=PI()*([.D8]/2)^2*[.E8] -> 1.22718463030851 | P8: of:=[.F8]/[.O8] -> 0.162974661726101 | Q8: of:=[.M8]/[.F8] -> 20000
A11: RTG
A12: PB-NUK | B12: rtg | C12: specializedElectrics | D12: 0.2 | E12: of:=0.3268025*2 -> 0.653605 | F12: 0.08 | G12: 0.2 | H12: 0.2 | I12: 1 | J12: 7 | K12: 3000 | M12: 0.75 | O12: of:=PI()*([.D12]/2)^2*[.E12] -> 0.0205336066634956 | P12: of:=[.F12]/[.O12] -> 3.89605203367527 | Q12: of:=[.M12]/[.F12] -> 9.375
P18: 4800
M19: of:=[.Q8] -> 20000 | N19: 0.175 | O19: of:=[.M19]*[.N19] -> 3500 | P19: of:=[.P18]/[.O19] -> 1.37142857142857
M20: 20000 | N20: of:=[.O20]/[.M20] -> 1.28 | O20: of:=[.P18]/[.P20] -> 25600 | P20: 0.1875